{
  "metadata": {
    "name": "Baz Needs Catalogue — Bank of Ireland Personal Banking",
    "version": "0.1",
    "as_of": "2026-10-05",
    "scope": "BOI personal banking in the Republic of Ireland. Business, corporate, private banking and wealth management are excluded except where a personal journey overlaps.",
    "purpose": "Turn conversational context into evidence-backed need candidates, then clarify, surface, defer or suppress BOI options.",
    "source_policy": "Live product facts, eligibility, rates, offers and scheme availability must come from controlled BOI data; never from model memory.",
    "sources": {
      "current_accounts": "https://personalbanking.bankofireland.com/bank/current-accounts/",
      "savings": "https://personalbanking.bankofireland.com/save-and-invest/savings/online-deposits/",
      "loans": "https://personalbanking.bankofireland.com/borrow/loans/",
      "credit_cards": "https://personalbanking.bankofireland.com/borrow/credit-cards/compare-credit-cards/",
      "mortgages": "https://personalbanking.bankofireland.com/borrow/mortgages/",
      "home_insurance": "https://personalbanking.bankofireland.com/insure-and-protect/insurance/home-insurance/",
      "travel_insurance": "https://personalbanking.bankofireland.com/insure-and-protect/insurance/travel-insurance/",
      "life_insurance": "https://personalbanking.bankofireland.com/insure-and-protect/life-insurance/",
      "pensions": "https://personalbanking.bankofireland.com/plan/pensions/",
      "investments": "https://personalbanking.bankofireland.com/save-and-invest/investments/",
      "international": "https://personalbanking.bankofireland.com/bank/international-payments/sending-money-abroad/"
    }
  },
  "operating_model": {
    "dimensions": [
      "life_event",
      "goal",
      "financial_circumstance",
      "existing_relationship"
    ],
    "signal_strengths": {
      "explicit": {
        "score": 1.0,
        "description": "Customer directly states the need or product intent."
      },
      "strong_inferred": {
        "score": 0.7,
        "description": "Circumstances strongly suggest the need; normally clarify before surfacing."
      },
      "soft_inferred": {
        "score": 0.35,
        "description": "Supporting context only; insufficient on its own."
      }
    },
    "recommended_states": [
      "LATENT",
      "CLARIFY",
      "READY_TO_SURFACE",
      "SURFACED",
      "ACCEPTED",
      "DECLINED",
      "DEFERRED",
      "SUPPRESSED"
    ],
    "recommended_thresholds": {
      "clarify": 0.5,
      "surface": 0.75
    },
    "principle": "Evidence can suggest a need; the customer decides whether to pursue a product."
  },
  "global_suppressions": [
    {
      "id": "financial_distress_credit_suppression",
      "when": [
        "persistent inability to meet normal living costs",
        "arrears or repeated missed payments disclosed",
        "cannot afford essentials"
      ],
      "suppress_families": [
        "loans",
        "credit_cards",
        "borrowing"
      ],
      "route_to": "money-worries/support journey",
      "reason": "Do not answer structural financial difficulty with opportunistic credit."
    },
    {
      "id": "active_mortgage_unsecured_credit_defer",
      "when": [
        "active mortgage application",
        "mortgage affordability/underwriting in progress"
      ],
      "deprioritise": [
        "personal_loan",
        "car_loan",
        "green_car_loan",
        "credit_cards",
        "overdraft"
      ],
      "reason": "New commitments may affect mortgage assessment."
    },
    {
      "id": "short_horizon_investment_suppression",
      "when": [
        "money required within roughly five years",
        "customer requires capital certainty or near-term access"
      ],
      "suppress_families": [
        "investments"
      ],
      "prefer_families": [
        "savings"
      ],
      "reason": "Short-term saving and investment risk solve different problems."
    },
    {
      "id": "sensitive_health_noncommercialisation",
      "when": [
        "customer discloses diagnosis/illness/treatment without asking about protection"
      ],
      "suppress": [
        "income_protection",
        "specified_illness_cover",
        "family_life_cover"
      ],
      "reason": "Health disclosure is not a sales trigger."
    },
    {
      "id": "declined_product_cooling",
      "when": [
        "customer explicitly declines a surfaced product"
      ],
      "action": "Do not resurface unless circumstances materially change or customer asks.",
      "reason": "Respect customer agency."
    },
    {
      "id": "competitor_scope",
      "when": [
        "customer asks for comparative claims about another bank"
      ],
      "action": "Explain BOI options only; do not provide competitor recommendation.",
      "reason": "Keep Baz within approved BOI domain."
    }
  ],
  "products": [
    {
      "id": "personal_current_account",
      "name": "Personal Current Account",
      "family": "everyday_banking",
      "type": "product",
      "source": "https://personalbanking.bankofireland.com/bank/current-accounts/"
    },
    {
      "id": "joint_current_account",
      "name": "Joint Current Account",
      "family": "everyday_banking",
      "type": "journey_configuration",
      "source": "https://personalbanking.bankofireland.com/bank/current-accounts/"
    },
    {
      "id": "basic_bank_account",
      "name": "Basic Bank Account",
      "family": "everyday_banking",
      "type": "product",
      "source": "https://personalbanking.bankofireland.com/bank/current-accounts/"
    },
    {
      "id": "smart_start_account",
      "name": "Smart Start Account",
      "family": "youth_banking",
      "type": "product",
      "source": "https://personalbanking.bankofireland.com/bank/current-accounts/"
    },
    {
      "id": "second_level_account",
      "name": "Second Level Current Account",
      "family": "youth_banking",
      "type": "product",
      "source": "https://personalbanking.bankofireland.com/bank/current-accounts/"
    },
    {
      "id": "third_level_account",
      "name": "Third Level Current Account",
      "family": "student_banking",
      "type": "product",
      "source": "https://personalbanking.bankofireland.com/bank/current-accounts/"
    },
    {
      "id": "graduate_current_account",
      "name": "Graduate Current Account",
      "family": "graduate_banking",
      "type": "product",
      "source": "https://personalbanking.bankofireland.com/bank/current-accounts/"
    },
    {
      "id": "golden_years_account",
      "name": "Golden Years Current Account",
      "family": "retirement_banking",
      "type": "product",
      "source": "https://personalbanking.bankofireland.com/bank/current-accounts/"
    },
    {
      "id": "overdraft",
      "name": "Current Account Overdraft",
      "family": "borrowing",
      "type": "product_service",
      "source": "https://personalbanking.bankofireland.com/bank/current-accounts/"
    },
    {
      "id": "supersaver",
      "name": "SuperSaver Account",
      "family": "savings",
      "type": "product",
      "source": "https://personalbanking.bankofireland.com/save-and-invest/savings/online-deposits/"
    },
    {
      "id": "goalsaver",
      "name": "GoalSaver Account",
      "family": "savings",
      "type": "product",
      "source": "https://personalbanking.bankofireland.com/save-and-invest/savings/online-deposits/"
    },
    {
      "id": "mortgagesaver",
      "name": "MortgageSaver Account",
      "family": "savings",
      "type": "product",
      "source": "https://personalbanking.bankofireland.com/save-and-invest/savings/online-deposits/"
    },
    {
      "id": "notice_31_day",
      "name": "365 31-Day Notice Account",
      "family": "savings",
      "type": "product",
      "source": "https://personalbanking.bankofireland.com/save-and-invest/savings/online-deposits/"
    },
    {
      "id": "advantage_fixed_term",
      "name": "Advantage Fixed Term Deposit Account",
      "family": "savings",
      "type": "product",
      "source": "https://personalbanking.bankofireland.com/save-and-invest/savings/online-deposits/"
    },
    {
      "id": "instant_access_demand",
      "name": "Instant Access Demand Account / Money Pot",
      "family": "savings",
      "type": "product",
      "source": "https://personalbanking.bankofireland.com/save-and-invest/savings/online-deposits/"
    },
    {
      "id": "smart_start_money_pot",
      "name": "Smart Start Money Pot",
      "family": "youth_savings",
      "type": "product",
      "source": "https://personalbanking.bankofireland.com/save-and-invest/savings/online-deposits/"
    },
    {
      "id": "notice_deposit",
      "name": "Notice Deposit Account",
      "family": "savings",
      "type": "product",
      "source": "https://personalbanking.bankofireland.com/save-and-invest/savings/online-deposits/"
    },
    {
      "id": "child_savings",
      "name": "Save for Kids / Child Savings",
      "family": "savings",
      "type": "product",
      "source": "https://personalbanking.bankofireland.com/save-and-invest/savings/online-deposits/"
    },
    {
      "id": "currency_deposit",
      "name": "Currency Deposit Account",
      "family": "savings_fx",
      "type": "product",
      "source": "https://personalbanking.bankofireland.com/save-and-invest/savings/online-deposits/"
    },
    {
      "id": "personal_loan",
      "name": "Personal Loan",
      "family": "loans",
      "type": "product",
      "source": "https://personalbanking.bankofireland.com/borrow/loans/"
    },
    {
      "id": "graduate_loan",
      "name": "Graduate Loan",
      "family": "loans",
      "type": "product_variant",
      "source": "https://personalbanking.bankofireland.com/borrow/loans/"
    },
    {
      "id": "car_loan",
      "name": "Car Loan",
      "family": "loans",
      "type": "product",